{
  "schemaVersion": 1,
  "caseId": "catalog_wf_crud",
  "title": "工作流目录 CRUD 贯通",
  "channel": "web",
  "signedAgainstBuild": "heren-mid-2026.06.0",
  "signerId": "steven",
  "passes": false,
  "generatedAt": "2026-06-29T07:15:30.000Z",
  "verdictSummary": {
    "PASS": 1,
    "SUT_DEFECT": 1,
    "HARNESS_ERROR": 1,
    "NEEDS_HUMAN": 1
  },
  "steps": [
    {
      "stepId": "atstep_0",
      "intentId": "intent_0",
      "atom": "workflow.create",
      "intentText": "在工作流目录新建一条流程并打开详情",
      "action": {
        "kind": "click",
        "describe": "点击「新建流程」确认按钮",
        "resolution": "unique"
      },
      "verdict": "PASS",
      "reason": null,
      "postAssertions": [
        {
          "kind": "urlPathname",
          "op": "startsWith",
          "value": "/process/detail",
          "actual": "/process/detail/atl_8842",
          "ok": true,
          "soft": false
        },
        {
          "kind": "noErrorEnvelope",
          "op": "envelopeOk",
          "value": "status==200",
          "actual": "status==200",
          "ok": true,
          "soft": false
        }
      ],
      "forensics": {
        "lifecycle": {
          "pageerror": [],
          "crashed": false,
          "crashedAtStepId": null
        },
        "network": [
          {
            "url": "/ai-manager/process/saveOrModifyProcessData",
            "status": 200,
            "initiator": "atstep_0",
            "attributedStepId": "atstep_0",
            "errorEnvelope": {
              "field": "status",
              "expected": 200,
              "actual": 200,
              "ok": true
            }
          }
        ]
      },
      "observed": {
        "urlPathnameAfter": "/process/detail/atl_8842",
        "cleanTitles": [
          "流程详情"
        ],
        "toastTexts": [
          "新建成功"
        ],
        "replyText": null,
        "replyStreamUrl": null
      },
      "attachments": {
        "video": "step/atstep_0.mp4",
        "screenshot": "step/atstep_0.png",
        "trace": "trace/catalog_wf_crud.atstep_0.zip",
        "stepPage": "step/atstep_0.html",
        "videoAt": 0
      },
      "defectTicket": null
    },
    {
      "stepId": "atstep_1",
      "intentId": "intent_1",
      "atom": "workflow.save",
      "intentText": "保存当前流程",
      "action": {
        "kind": "click",
        "describe": "点击「保存」按钮",
        "resolution": "unique"
      },
      "verdict": "SUT_DEFECT",
      "reason": null,
      "postAssertions": [
        {
          "kind": "noErrorEnvelope",
          "op": "envelopeOk",
          "value": "status==200",
          "actual": "status==500",
          "ok": false,
          "soft": false
        },
        {
          "kind": "countChange",
          "op": "up",
          "value": 1,
          "actual": 0,
          "ok": false,
          "soft": true
        }
      ],
      "forensics": {
        "lifecycle": {
          "pageerror": [],
          "crashed": false,
          "crashedAtStepId": null
        },
        "network": [
          {
            "url": "/ai-manager/process/saveOrModifyProcessData",
            "status": 500,
            "initiator": "atstep_1",
            "attributedStepId": "atstep_1",
            "errorEnvelope": {
              "field": "status",
              "expected": 200,
              "actual": 500,
              "ok": false
            }
          },
          {
            "url": "/ai-manager/auths/poll",
            "status": 401,
            "initiator": "background",
            "attributedStepId": "atstep_0",
            "errorEnvelope": {
              "field": "status",
              "expected": 200,
              "actual": 401,
              "ok": false
            }
          }
        ]
      },
      "observed": {
        "urlPathnameAfter": "/process/detail/atl_8842",
        "cleanTitles": [
          "流程详情"
        ],
        "toastTexts": [
          "保存失败，服务异常"
        ],
        "replyText": null,
        "replyStreamUrl": null
      },
      "attachments": {
        "video": "step/atstep_1.mp4",
        "screenshot": "step/atstep_1.png",
        "trace": "trace/catalog_wf_crud.atstep_1.zip",
        "stepPage": "step/atstep_1.html",
        "videoAt": 4200
      },
      "defectTicket": {
        "failedAssertions": [
          {
            "kind": "noErrorEnvelope",
            "op": "envelopeOk",
            "value": "status==200",
            "actual": "status==500"
          }
        ],
        "backingForensics": [
          {
            "url": "/ai-manager/process/saveOrModifyProcessData",
            "status": 500,
            "attributedStepId": "atstep_1"
          }
        ],
        "videoAt": 4200,
        "traceRef": "trace/catalog_wf_crud.atstep_1.zip"
      }
    },
    {
      "stepId": "atstep_2",
      "intentId": "intent_2",
      "atom": "workflow.deleteByName",
      "intentText": "回到工作流目录，删除刚建的这条流程",
      "action": {
        "kind": "click",
        "describe": "点击该流程行的「删除」按钮",
        "resolution": "none"
      },
      "verdict": "HARNESS_ERROR",
      "reason": null,
      "postAssertions": [
        {
          "kind": "countChange",
          "op": "equals",
          "value": 0,
          "actual": 1,
          "ok": false,
          "soft": false
        }
      ],
      "forensics": {
        "lifecycle": {
          "pageerror": [],
          "crashed": false,
          "crashedAtStepId": null
        },
        "network": [
          {
            "url": "/ai-manager/process/queryProcessPage",
            "status": 200,
            "initiator": "atstep_2",
            "attributedStepId": "atstep_2",
            "errorEnvelope": {
              "field": "status",
              "expected": 200,
              "actual": 200,
              "ok": true
            }
          }
        ]
      },
      "observed": {
        "urlPathnameAfter": "/process/list",
        "cleanTitles": [
          "流程管理"
        ],
        "toastTexts": [],
        "replyText": null,
        "replyStreamUrl": null
      },
      "attachments": {
        "video": "step/atstep_2.mp4",
        "screenshot": "step/atstep_2.png",
        "trace": "trace/catalog_wf_crud.atstep_2.zip",
        "stepPage": "step/atstep_2.html",
        "videoAt": 7800
      },
      "defectTicket": null
    },
    {
      "stepId": "atstep_3",
      "intentId": "intent_3",
      "atom": "assert.onPage",
      "intentText": "确认该流程已从工作流目录消失",
      "action": {
        "kind": "none",
        "describe": "仅断言当前页，无点击动作",
        "resolution": "none"
      },
      "verdict": "NEEDS_HUMAN",
      "reason": "SUT_DEFECT_OR_STALE",
      "postAssertions": [
        {
          "kind": "textVisible",
          "op": "contains",
          "value": "暂无数据",
          "actual": "共 1 条",
          "ok": false,
          "soft": false
        }
      ],
      "forensics": {
        "lifecycle": {
          "pageerror": [],
          "crashed": false,
          "crashedAtStepId": null
        },
        "network": []
      },
      "observed": {
        "urlPathnameAfter": "/process/list",
        "cleanTitles": [
          "流程管理"
        ],
        "toastTexts": [],
        "replyText": null,
        "replyStreamUrl": null
      },
      "attachments": {
        "video": "step/atstep_3.mp4",
        "screenshot": "step/atstep_3.png",
        "trace": "trace/catalog_wf_crud.atstep_3.zip",
        "stepPage": "step/atstep_3.html",
        "videoAt": 9400
      },
      "defectTicket": null
    }
  ]
}